{"protocol":"rip","experiment":"m12-three-node-rip-netns","evidence_level":"real-capture","environment":{"os":"linux","kernel":"6.8.0-137-generic","topology":"three private namespaces A-B-C","tools":{"bird":"BIRD version 2.14","tshark":"TShark (Wireshark) 4.2.2 (Git v4.2.2 packaged as 4.2.2-1.1build3)."}},"capture_point":"pz-rip-b:any","command":"scripts/era2-rip-capture.sh","capture_filter":"udp port 520","result":{"handshake":"pass","capture":"captures/era2-rip/rip-convergence.pcapng","frames":32,"route_a_learned":"198.18.163.1/32","route_c_learned":"198.18.161.1/32"},"sanitized":true,"notes":["Three-node RIPv2 propagation used only 198.18.160.0/24-style documentation ranges inside namespaces."]}
