{"protocol":"6to4-private-sit","experiment":"m15-private-ipv6-in-ipv4-netns","evidence_level":"real-capture","environment":{"os":"linux","kernel":"6.8.0-137-generic","topology":"private netns-veth plus SIT tunnel","tools":{"ip":"ip utility, iproute2-6.1.0, libbpf 1.3.0","tcpdump":"tcpdump version 4.99.4","tshark":"TShark (Wireshark) 4.2.2 (Git v4.2.2 packaged as 4.2.2-1.1build3)."}},"capture_point":"pz-m15-b:pz-m15-vb","command":"scripts/era2-ipv6-capture.sh","capture_filter":"ip proto 41 or icmp6","result":{"handshake":"pass","capture":"captures/era2-ipv6/sit-ipv6-in-ipv4.pcapng","frames":8,"outer_protocol":41,"inner_protocol":"IPv6/ICMPv6"},"sanitized":true,"notes":["Private SIT-style IPv6-in-IPv4 only; no public 6to4 anycast, Teredo relay, ISATAP broker, or NAT64 service was contacted."]}
