{"protocol":"ppp","experiment":"m11-ppp-private-pty","evidence_level":"real-capture","environment":{"os":"linux","kernel":"6.8.0-137-generic","topology":"two netns pppd endpoints bridged by private socat PTYs","tools":{"pppd":"pppd version 2.4.9","socat":"socat by Gerhard Rieger and contributors - see www.dest-unreach.org","tshark":"TShark (Wireshark) 4.2.2 (Git v4.2.2 packaged as 4.2.2-1.1build3)."}},"capture_point":"pz-m11-a:any (PPP data observed on ppp0)","command":"scripts/era2-ppp-capture.sh","capture_filter":"icmp","result":{"handshake":"pass","capture":"captures/era2-ppp/ppp-icmp.pcapng","frames":4,"lcp_ipcp":"pass","serial_hdlc":"pass"},"sanitized":true,"notes":["Only private PTYs, namespaces and 198.18.170.0/24 were used."]}
