{"protocol":"icmp","experiment":"icmp-lifecycle-netns","evidence_level":"real-capture","environment":{"os":"linux","kernel":"6.8.0-137-generic","topology":"private netns-veth","tools":{"tcpdump":"tcpdump version 4.99.4","tshark":"TShark (Wireshark) 4.2.2 (Git v4.2.2 packaged as 4.2.2-1.1build3)."}},"capture_point":"pz-era2-b:pz-era2-b0","command":"scripts/era2-network-capture.sh","capture_filter":"icmp","result":{"handshake":"pass","capture":"captures/era2-network/icmp-lifecycle.pcapng","frames":4},"sanitized":true,"notes":["Only 198.18.130.0/24 and multicast group 239.1.1.1 inside private namespaces were used."]}
