{"protocol":"sctp","experiment":"phase-6-sctp-netns-kali","environment":{"os":"kali","kernel":"6.19.14+kali-amd64","topology":"nested-netns-veth","tools":{"tcpdump":"tcpdump version 4.99.6","tshark":"TShark (Wireshark) 4.6.6."}},"capture_point":"pz-b:pz-veth-b","command":"scripts/kali-sctp-capture.sh","capture_filter":"sctp port 19090","result":{"handshake":"pass","capture":"captures/kali-sctp/sctp.pcap","frames":11},"sanitized":true,"notes":["SCTP kernel module loaded inside Kali guest.","Nested namespaces used; synthetic payload only; no default route or external interface."]}
